<?xml version="1.0" encoding="UTF-8"?>
<GponScript xmlns:xsi="http://www.w3.org/2001/XMLSchema-instance" 
            xmlns="http://berlios.de/gpon/xmlscript"
            xsi:noNamespaceSchemaLocation="../xml/xsd/gponscript.xsd" >
	<Processing>
		<Commit>auto</Commit>
		<Results>
			<Smtp/>
		</Results>
	</Processing>
	<!--  
	<Removal>
	  <Union>
	   <Query type="Person"/>
	   <Query type="Car"/>
	  </Union>
	</Removal>
    -->
	<Creation id="HellDrivers" type="Person">
	 <OrUpdateUsingKeys>
	  <Key name="name"/>
	  <Key name="firstname"/>
	 </OrUpdateUsingKeys>
	 <CreateObject>
	  <Property name="name"      value="Schulz"/>
	  <Property name="firstname" value="Daniel"/>
	  <Property name="birthday"  value="1.2.1974"/>
	 </CreateObject>
	 <CreateObject> 
	  <Property name="name"      value="Schulz"/>
	  <Property name="firstname" value="Claire (Schatzi)"/>
	  <Property name="birthday"  value="30.5.1973 8:52:15"/>
	 </CreateObject>
	 <CreateObject> 
	  <Property name="name"      value="Schulz"/>
	  <Property name="firstname" value="Claire"/>
	  <Property name="birthday"  value="30.5.1973 8:52:15"/>
	 </CreateObject>
	</Creation>

    <!-- this car is associated with 2 drivers -->	

	<Creation id="OneCar" type="Car">
	 <OrUpdateUsingKeys>
	  <Key name="license.plate.no"/>
	 </OrUpdateUsingKeys>
	 <CreateObject>
	    <Property name="license.plate.no" value="LOS-LJ 256"/>
    	<Property name="chassis.no" value="TMBXY1234567890"/>
        <Property name="yom" value="1.10.2005"/>
        <Property name="color" value="black"/>
	    <AssociateWith type="driver" role="car">
		 <Reference refid="HellDrivers"/>
	    </AssociateWith>
	 </CreateObject>
	</Creation>
	
	<Query id="PersonsThatAreDrivers" type="Person">
	 <Associated by="driver" role="driver"/>
	</Query>
	
	<Query id="PersonsThatAreDrivers2" type="Person">
	 <Associated by="driver" role="driver">
	  <Query id="AllCars" type="Car"/>
	 </Associated>
	</Query>
</GponScript>
